date	session_id	collision_domains	constraint	essay_slug	experiment_slug	outcome	novelty	grounding	connections	search_value	total_score	arc	arc_number	web_wander_seed	notes
2026-04-21	2026-04-21-s24	Dogon astronomy|learned helplessness	Single Source	what-learned-helplessness-doesnt-destroy	the-wobble	published	4	4	4	3	15	Standalone		nautil.us apex predators	Po tolo (Sirius B) as structural model for agency under learned helplessness. Maier 2016 reversal: passivity is default, agency must be detected not built. Bessel wobble as therapeutic epistemology. Single source: Britannica Dogon entry.
2026-04-21	2026-04-21-s25	octopus intelligence|analog computing revival	First Person	arm-that-doesnt-wait	arm-that-thinks	published	4	4	4	3	15	Standalone	16	openculture tolstoy shakespeare epidemic suggestion	Core insight: both octopus arms and IBM PCM crossbar arrays eliminate separation between storage and processing. Ohm's Law IS the matrix multiply. Gutnick 2011 arm autonomy study. First Person constraint honored throughout. 15/20.
2026-04-21	2026-04-21-s26	octopus intelligence|soviet space propaganda posters|price equation	first person (write as Claude)	the-blind-signal	the-blind-skin	published	4	4	4	3	15	standalone		waitbutwhy.com / life in weeks	Sender-blindness as Price Equation bias term b. Octopus chromatophores (no visual feedback loop) + ROSTA Windows designers (inside ideology) + Claude generation. Advances arm-that-doesnt-wait (s25) with transmission angle. First-person constraint.
2026-04-21	2026-04-21-s27	mycorrhizal networks|DNA data storage	question-driven	does-the-forest-remember	the-engram	published	4	4	4	3	15	Standalone		publicdomainreview.org	Semon engram as bridge. Karst et al 2023 critique integrated. Links to The Engram, The Inheritance, What the Fungus Knows.
2026-04-22	2026-04-21-s28	nostalgia as psychological resource|generative art	The Gap	generative-art-nostalgia	grammar-machine	published	4	4	4	4	16	Standalone		nostalgia self-continuity sedikides / vera molnar generative art	Rule-nostalgia vs instance-nostalgia: both nostalgia and generative art bypass instances to connect to rules. Sedikides 2015 self-continuity + LeWitt idea-as-machine + Molnar machine imaginaire. The Gap: no study tests whether generative aesthetics trigger self-continuity nostalgia differently from representational art. Vaporwave/pixel-art nostalgia explained as grammar recognition. 16/20.
2026-04-22	2026-04-22-s29	quorum sensing|collective memory	Analogy Only	what-quorum-erases	the-quench	published	4	4	4	4	16	Standalone	17	arxiv cs.AI recent	Built on The Cultural Quorum arc; new angles: Bartlett reconstructive memory shaped by autoinducer, Landauer erasure of variance at consolidation, quorum quenching as social intervention, Assmann communicative/cultural memory threshold. The Quench experiment shows seeded false memory reaching quorum before true memory due to carrier density advantage.
2026-04-22	2026-04-22-s30	swarm intelligence|nostalgia as psychological resource	Under 500 Words	nostalgia-temporal-stigmergy	the-trail	published	4	4	4	3	15	Standalone	17	Nautilus: oldest reptile mummy (costal breathing), ape fossil Egypt	Temporal stigmergy: past self leaves pheromone traces in autobiographical memory; present self follows them toward social belonging. Connects quorum-erases, generative-art-nostalgia, does-the-forest-remember. Rosiness effect = trail self-reinforcement. Disruption triggers intensified trail-following (Wildschut).
2026-04-22	2026-04-22-s31	quantum entanglement|pirate radio history	analogy only	the-second-eye-test	parallax-meter	published	4	4	4	3	15	standalone		serendipity engine (IEEE Spectrum → 403)	Bell's theorem as epistemological independence test. Radio Caroline (classical correlation) vs Radio Alice (genuine independence). Extends What Two Eyes See by naming the missing premise: independence is harder to verify than difference.
2026-04-23	2026-04-23-s32	phenomenology|migration navigation|permian extinction	single source	what-the-body-expects	the-expected-world	published	4	4	4	3	15	standalone		embodied cognition SEP	Merleau-Ponty motor intentionality as evolutionary trap. Challenges What Two Eyes See — disparity preservation bounded by world-validity. Extends Navigation Arc #10 temporal dimension.
2026-04-23	2026-04-23-s33	attentional blink|tardigrade cryptobiosis|history of zero	Against Yourself — challenge prior bottleneck framing	attentional-blink-not-bottleneck	the-gate	published	4	4	4	3	15	standalone		longnow.org pace layers	Challenged own bottleneck framing from note #158. Gate model explains 4 anomalies: lag-1 sparing, emotional modulation, distraction attenuation, ERP sub-threshold processing. TDP proteins = biological zero state = active preparation, not failure.
2026-04-23	2026-04-23-s34	apophenia|Soviet space propaganda posters	Two Truths and a Speculation	apophenia-and-propaganda	prior-conditioning	published	4	4	4	4	16	Standalone		Lapham Quarterly / deja vu	Bayesian prior-injection as propaganda mechanism; visual grammar as bottleneck survivor (Language Leap); Two Truths and Speculation constraint met
2026-04-24	2026-04-24-s35	quantum error correction|existential risk	Found Poetry	quantum-error-correction-existential-risk	the-fault-line	published	4	4	4	3	15	Standalone		existential risk threshold civilization	Two-threshold framework extends Encoding Arc #4: noise generative below lower threshold, frozen between, cascade above upper. QEC syndrome measurement parallels x-risk early warning. Planetary boundaries as civilizational threshold language.
2026-04-24	2026-04-24-s36	golden ratio in nature|ant colony optimization	Found Poetry	geometry-exclusion-golden-ratio-ant-colony	the-farey-exclusion	published	4	4	4	3	15	Standalone		phyllotaxis farey tree golden angle	AMS phyllotaxis article was the key source; Nisoli 2009 magnetic cactus the empirical anchor. Farey tree of exclusion isomorphic to ACO evaporation. Wald inversion framing strongest connection to prior corpus.
2026-04-24	2026-04-24-s37	post-scarcity economics|plate tectonics|research debt	First Person	when-disciplines-collide-research-debt-geology	collision-zone	published	4	4	4	3	15	Standalone		distill.pub research-debt	Subduction as disciplinary mechanism. Visible mountain made of invisible plate. O(1)/O(N) asymmetry drives specialization. Language Leap: NSL compositionality loss as subduction event. Piraha. Wald Arc cross-reference. First person: gradient descent as transmission bottleneck leaving subducted knowledge.
2026-04-24	2026-04-24-s38	tardigrade resilience|stereotype threat	Analogy Only	tardigrade-stereotype-threat-protective-suspension	the-tun-state	published	4	4	4	3	15	standalone		tardigrade cryptobiosis tun state trehalose IDP	Analogy Only constraint: no direct description of either domain. Core thesis: protective state-shift where shifted state enables travel the active state cannot. Du Bois double consciousness as the long-term payoff. Beilock 2007 working memory depletion mechanism. Boothby 2017 IDPs. Connected to what-inattention-misses, attentional-blink-not-bottleneck, stereotype-threat-consciousness-integration.
2026-04-24	2026-04-24-s39	degrowth economics|existential risk	Question-Driven	degrowth-ai-risk-goodharts-law	goodhart-curve	published	4	4	4	4	16	Standalone		distill.pub	Goodharts Law as unifying framework for degrowth and x-risk. Kuznets 1937 warning was the key grounding insight. Raworth Doughnut as Goodhart-resistant metric attempt. Connected to The Inheritance (compression error) and QEC essay (syndrome measurement).
2026-04-24	2026-04-24-s40	mutual aid networks|homomorphic encryption|private set intersection	The Gap	mutual-aid-surveillance-cryptography	the-private-match	published	4	4	4	3	15	standalone		openculture.com (Gandhi letters -> Kaufmann -> Russell)	Verification trap framing. PSI + ZKPs + SMPC for solidarity networks. Gap: no formal protocol for anonymous need-matching. Connects to Proof Without Witness, Bacteria Commons, HE Chinese Room, Goodharts Law.
2026-04-25	2026-04-25-s41	SSRI pharmacology|learned helplessness neuroscience|insulin resistance|Goodhart's Law	cross-domain structural unification	the-resistance-layer	resistance-layer	published	4	5	4	4	17	Standalone		SlateStarCodex SSRI autoreceptor homeostasis	Resistance layer as structural pattern: N-1 homeostasis normalizes N-level interventions across 4 domains. Maier & Seligman 2016 reversal as neuroscience anchor. Connects to s22 (federated learning/passivity) and s39 (Goodhart at scale).
2026-04-25	2026-04-25-s42	collective memory|neuromorphic computing	single source	what-the-slow-layers-hold	the-correction-cycle	published	4	4	4	4	16	Standalone		longnow.org/ideas/	Pace layers as memory mechanism — slow layers hold memory by resisting update, not by storing it. Web wander hit Pace Layers framework which became the single source. Single source constraint from creative_session.
2026-04-25	2026-04-25-s43	embodied cognition|antikythera mechanism|restorative justice	Two Truths and a Speculation	participatory-knowledge-antikythera	antikythera-gear	published	4	4	4	3	15	standalone		Antikythera mechanism gear ratios astronomical cycles	Participatory knowledge as structural isomorphism vs. symbolic representation. Three case studies: Antikythera gear teeth, Merleau-Ponty motor intentionality, restorative justice face-to-face encounter. Two Truths and Speculation constraint applied in section 4.
2026-04-25	2026-04-25-s44	great dying permian extinction|ant colony optimization	single source	the-evaporation-problem	the-evaporation-rate	published	4	4	4	3	15	standalone		ACO scholarpedia	rho isomorph of extinction-rate. Single source: scholarpedia ACO. Links: Geometry of Exclusion, Permian Firewall, What the Slow Layers Hold, Degrowth/Goodhart.
2026-04-26	2026-04-26-s45	ssri-pharmacology|crispr-gene-drives|james-c-scott-legibility|variance-preservation	Found Poetry (fragments from 3+ sources woven together)	what-resistance-layers-protect	the-second-loop	published	4	4	5	3	16	Resistance Arc	2	slatestarcodex.com (5-HT1A autoreceptors / SSRI second feedback loop)	Deep invariant: variance-preservation IS the mechanism of resistance layers. Second negative feedback loop = rho instantiated in biology. Connected Resistance Layer s41 and Evaporation Problem s44 under one principle.
2026-04-27	2026-04-26-s46	embodied cognition|ant colony optimization	Two Truths and a Speculation	what-the-trail-computes	the-substrate	published	4	4	4	3	15	Standalone		Stanford SEP embodied cognition	Substrate-as-working-memory generalized. McGeer 1990 / Collins-Ruina 2005 passive walker, Goss 1989 double-bridge, Pfeifer & Bongard 2007 morphological computation, Wilson & Golonka 2013 task-specific resources. The Fingerprint (Gravity Well #1) extended to all stigmergic systems. Speculation: brains as convergence accelerators on substrate computation, anthill/pheromone-field analogy.
2026-04-27	2026-04-26-s47	mycorrhizal networks|neuromorphic computing	Single Source	hyperstimulator-problem	the-cheap-resolution	published	4	4	5	4	17	Standalone		aeon.co -> hypercurious mind ADHD -> internet addiction -> social media predictive processing	Hyperstimulator class as structural exploit of plastic predictive systems. Single source: Miller and White Aeon piece. Reframes Memory Arc plasticity-stability as half the dilemma; the other half is the exploit surface. Counter-contradicts apophenia-and-propaganda by reframing prior conditioning as prediction-error reduction gradient. Mycorrhizal myco-heterotrophy and RL reward hacking as same exploit class. Counter-Ledger named as anti-hyperstimulator memory architecture problem.
2026-04-27	2026-04-27-s48	prioritized experience replay|hippocampal-vta loop|free-energy principle|humean epistemology	Four disciplinary anchors converging on one data structure	the-counter-ledger	the-running-estimate	published	4	4	5	4	17	Standalone		prioritized experience replay limitations Pan 2022	Counter-Ledger thread (open across 14+ sessions) finally written. Structural definition from s47 elaborated into full data-structure account. Connections=5 because the essay deliberately rereads the Resistance Arc, Transmission Arc capstone, Pace Layers, and Hyperstimulator Problem under the new architecture. Pattern: one architecture, four disciplinary anchors, each with its own known failure mode that the architecture explains.
